{"actual_engine_templates":[{"capital_spend_hits":5,"delivered_passengers":21,"delivery_interval_return":0.56732177734375,"delivery_reward_hits":119,"income":117,"operating_profit_hits":505,"reward_component_hits":{"RC-001":119,"RC-002":505,"RC-003":5,"RC-004":504,"RC-005":0,"RC-006":2,"RC-007":0,"RC-008":0},"template_id":"m02-template-01","transitions_to_service":29},{"capital_spend_hits":5,"delivered_passengers":21,"delivery_interval_return":0.57781982421875,"delivery_reward_hits":2,"income":117,"operating_profit_hits":22,"reward_component_hits":{"RC-001":2,"RC-002":22,"RC-003":5,"RC-004":21,"RC-005":0,"RC-006":2,"RC-007":0,"RC-008":0},"template_id":"m02-template-02","transitions_to_service":29},{"capital_spend_hits":5,"delivered_passengers":25,"delivery_interval_return":0.82293701171875,"delivery_reward_hits":2,"income":140,"operating_profit_hits":22,"reward_component_hits":{"RC-001":2,"RC-002":22,"RC-003":5,"RC-004":21,"RC-005":0,"RC-006":2,"RC-007":0,"RC-008":0},"template_id":"m02-template-03","transitions_to_service":29},{"capital_spend_hits":5,"delivered_passengers":22,"delivery_interval_return":0.64361572265625,"delivery_reward_hits":2,"income":123,"operating_profit_hits":22,"reward_component_hits":{"RC-001":2,"RC-002":22,"RC-003":5,"RC-004":21,"RC-005":0,"RC-006":2,"RC-007":0,"RC-008":0},"template_id":"m02-template-04","transitions_to_service":29},{"capital_spend_hits":5,"delivered_passengers":25,"delivery_interval_return":0.76934814453125,"delivery_reward_hits":1,"income":177,"operating_profit_hits":26,"reward_component_hits":{"RC-001":1,"RC-002":26,"RC-003":5,"RC-004":25,"RC-005":0,"RC-006":2,"RC-007":0,"RC-008":0},"template_id":"m02-template-05","transitions_to_service":33},{"capital_spend_hits":5,"delivered_passengers":19,"delivery_interval_return":0.404541015625,"delivery_reward_hits":2,"income":135,"operating_profit_hits":25,"reward_component_hits":{"RC-001":2,"RC-002":25,"RC-003":5,"RC-004":24,"RC-005":0,"RC-006":2,"RC-007":0,"RC-008":0},"template_id":"m02-template-06","transitions_to_service":32},{"capital_spend_hits":5,"delivered_passengers":24,"delivery_interval_return":0.74371337890625,"delivery_reward_hits":2,"income":144,"operating_profit_hits":23,"reward_component_hits":{"RC-001":2,"RC-002":23,"RC-003":5,"RC-004":22,"RC-005":0,"RC-006":2,"RC-007":0,"RC-008":0},"template_id":"m02-template-07","transitions_to_service":30},{"capital_spend_hits":5,"delivered_passengers":31,"delivery_interval_return":1.17535400390625,"delivery_reward_hits":2,"income":186,"operating_profit_hits":24,"reward_component_hits":{"RC-001":2,"RC-002":24,"RC-003":5,"RC-004":23,"RC-005":0,"RC-006":2,"RC-007":0,"RC-008":0},"template_id":"m02-template-08","transitions_to_service":31}],"executable_sha256":"765c108213bfbb23df2712956acb9bbf6bbb5b0a1d446b0ec154a94fbf41876c","exploit_campaign":{"bankruptcy_bootstrap":false,"bankruptcy_final_observation_sha256":"5d84b70ce02725a572695d6caa80741df7d0da90397611fa0abc756448124550","bankruptcy_return":-8.015625,"bankruptcy_terminal":true,"construction_return":-0.39190673828125,"cycling_return":-0.072021484375,"duplicate_attempt_advanced_ticks":0,"duplicate_attempt_rewarded":false,"idle_return":-0.181396484375,"native_rejection_return":-1.0078125,"noop_return":-0.540771484375,"vehicle_loss_return":-2.015625},"horizon_and_rollover":{"final_observation_sha256":"39ecc4df9b6fb66372fd431db8ab6d948482fe98e785d237b4884c4216176af8","quarter_counter_resets":9,"reason":"ACTION_AND_TICK_HORIZON","relative_ticks":65536,"transition_ordinal":512},"native_delta":{"composed_source_identity_sha256":"98693ab0595fb26612079683a192a12f7bce6bb4cb25a7edf895244c50c568a2","patch_sha256":"ce2a423e5f78aed861d0ca032a21509ce976267f17718cea8e3a973f8d24e912","result_tree":"56b7f68297cb1ec7548c25ac9dfa0d0088e70547","series_sha256":"b001a2bffe511d1814dd820373b129d887d35cce7ad38bd02dcce5ccc106bbff"},"reward_compatibility_sha256":"9d8f9c2fc6074d899fa3b0047c55e3fb15cc5c17cddeaceaa1fd5389e53c8c9e","reward_contract_sha256":"28712c2b7fcf009e3ceda0ebbc2f18d382f28f780adb52186a08ab871998a2e7","schema_version":"openttd-rl-v1-m06-reward-oracle-report-1","status":"PASS","trajectory":{"bundle_sha256":"0417d8ece711f8e1025a86eb3d96662133afab8521ccbc70ec8fc12797a62f3a","observation_blob_count":129,"record_count":128,"round_trip":"PASS"}}
